{
  "$schema": "http://json-schema.org/draft-07/schema#",
  "$id": "https://qbind.dev/schemas/public-devnet/PACKAGE_INTEGRITY_MANIFEST.schema.json",
  "title": "QBIND Public DevNet Package Integrity Manifest",
  "description": "Canonical, publish-safe manifest describing the documented QBIND public DevNet release-package DOCUMENTATION artifact tree under docs/release/public-devnet. It lets an operator or reviewer confirm that the listed package files are present and unchanged (SHA-256 + byte size) before following OPERATOR_VERIFICATION_MAP.md. Docs/artifact only: it embeds NO binary blob, NO secret, NO private path/hostname/endpoint, NO raw log, NO raw /metrics dump, and NO generated private identity. It is NOT binary provenance (see binary/RELEASE_ARTIFACT_MANIFEST.schema.json for that) and it moves NO readiness item: M4 stays Yellow, M6 stays Yellow/Partial, S5/S7 stay Yellow, public DevNet stays NOT launch-ready, and C4/C5 stay OPEN.",
  "type": "object",
  "additionalProperties": false,
  "required": [
    "manifest_version",
    "generated_for_run",
    "scope",
    "safety_labels",
    "package_root",
    "files",
    "non_claims",
    "artifact_safety_label"
  ],
  "properties": {
    "manifest_version": {
      "description": "Manifest schema version (semver of this schema contract).",
      "type": "string",
      "pattern": "^[0-9]+\\.[0-9]+\\.[0-9]+$"
    },
    "generated_for_run": {
      "description": "The QBIND run number this manifest was generated for. Fixed to 404.",
      "type": "integer",
      "const": 404
    },
    "scope": {
      "description": "Stable scope tag for this manifest. Documentation package only.",
      "type": "string",
      "const": "public-devnet-docs-release-package"
    },
    "safety_labels": {
      "description": "Standing safety labels every artifact this manifest describes carries. All required labels must be present.",
      "type": "array",
      "uniqueItems": true,
      "items": {
        "type": "string",
        "enum": [
          "devnet",
          "experimental",
          "resettable",
          "no_value",
          "no_uptime_sla",
          "not_launch_ready",
          "c4_open",
          "c5_open"
        ]
      },
      "minItems": 8,
      "allOf": [
        { "contains": { "const": "devnet" } },
        { "contains": { "const": "experimental" } },
        { "contains": { "const": "resettable" } },
        { "contains": { "const": "no_value" } },
        { "contains": { "const": "no_uptime_sla" } },
        { "contains": { "const": "not_launch_ready" } },
        { "contains": { "const": "c4_open" } },
        { "contains": { "const": "c5_open" } }
      ]
    },
    "package_root": {
      "description": "Repository-relative root of the documented public DevNet package. All file relative_path values are resolved against this root. Never an absolute path.",
      "type": "string",
      "const": "docs/release/public-devnet"
    },
    "generated_at_utc": {
      "description": "OPTIONAL UTC timestamp (ISO-8601, Zulu) when this manifest was generated. May be included only if the reproducibility rules in PACKAGE_INTEGRITY.md are followed honestly; hashes and byte sizes are the authoritative integrity signal and do not depend on this field.",
      "type": "string",
      "pattern": "^[0-9]{4}-[0-9]{2}-[0-9]{2}T[0-9]{2}:[0-9]{2}:[0-9]{2}Z$"
    },
    "files": {
      "description": "The documented public DevNet package file entries covered by this manifest.",
      "type": "array",
      "minItems": 1,
      "items": {
        "type": "object",
        "additionalProperties": false,
        "required": [
          "relative_path",
          "sha256",
          "byte_size",
          "artifact_group",
          "readiness_item",
          "status",
          "verification_reference"
        ],
        "properties": {
          "relative_path": {
            "description": "Path of the file RELATIVE to package_root (docs/release/public-devnet). Forward-slash separated, never absolute, never containing '..', never a Windows drive path.",
            "type": "string",
            "pattern": "^(?!/)(?!.*\\.\\.)(?![A-Za-z]:)[A-Za-z0-9._-]+(/[A-Za-z0-9._-]+)*$"
          },
          "sha256": {
            "description": "Lowercase hex SHA-256 of the on-disk file at package_root/relative_path.",
            "type": "string",
            "pattern": "^[0-9a-f]{64}$"
          },
          "byte_size": {
            "description": "Exact byte size of the on-disk file.",
            "type": "integer",
            "minimum": 0
          },
          "artifact_group": {
            "description": "The artifact group (matches ARTIFACT_INDEX.md) the file belongs to.",
            "type": "string",
            "enum": [
              "genesis",
              "binary",
              "operator",
              "identity",
              "p2p",
              "network",
              "security",
              "observability",
              "ops",
              "recovery",
              "status",
              "top-level"
            ]
          },
          "readiness_item": {
            "description": "The readiness matrix item(s) the file's group covers, verbatim label (e.g. 'M4', 'M6', 'S5', 'S7', 'M1/M19/M20', 'launch-gate').",
            "type": "string",
            "minLength": 1
          },
          "status": {
            "description": "The current recorded status of the file's group. Must not overclaim: Yellow items stay Yellow.",
            "type": "string",
            "enum": [
              "green",
              "green-for-scope",
              "yellow",
              "yellow-partial",
              "no-go"
            ]
          },
          "verification_reference": {
            "description": "Repository-relative pointer to the VERIFY.md / doc / harness used to verify the file's group. Never an absolute path.",
            "type": "string",
            "minLength": 1
          }
        }
      }
    },
    "non_claims": {
      "description": "Explicit non-claim booleans. Every field must be exactly as fixed below (this manifest makes none of these claims).",
      "type": "object",
      "additionalProperties": false,
      "required": [
        "launches_public_devnet",
        "moves_m4_green",
        "moves_m6_green",
        "moves_s5_green",
        "moves_s7_green",
        "closes_c4",
        "closes_c5",
        "claims_testnet_ready",
        "claims_mainnet_ready",
        "deploys_seed_or_service",
        "mutates_runtime_state"
      ],
      "properties": {
        "launches_public_devnet": { "type": "boolean", "const": false },
        "moves_m4_green": { "type": "boolean", "const": false },
        "moves_m6_green": { "type": "boolean", "const": false },
        "moves_s5_green": { "type": "boolean", "const": false },
        "moves_s7_green": { "type": "boolean", "const": false },
        "closes_c4": { "type": "boolean", "const": false },
        "closes_c5": { "type": "boolean", "const": false },
        "claims_testnet_ready": { "type": "boolean", "const": false },
        "claims_mainnet_ready": { "type": "boolean", "const": false },
        "deploys_seed_or_service": { "type": "boolean", "const": false },
        "mutates_runtime_state": { "type": "boolean", "const": false }
      }
    },
    "artifact_safety_label": {
      "description": "Standing human-readable safety label for every artifact this manifest describes.",
      "type": "string",
      "const": "experimental · resettable · no value · no uptime SLA · NOT public-DevNet launch-ready · no MainNet readiness claim · no C4/C5 closure claim"
    }
  }
}